{
  "$schema": "./schemas/go-tips.schema.json",
  "schema_version": "1.1",
  "description": "Japanese Go terminology tips displayed to users during puzzle sessions. Each tip includes romanized terms with poetic English definitions, filtered by difficulty level. https://senseis.xmp.net/?GoProverbs",
  "last_updated": "2026-02-18",
  "changelog": [
    {
      "version": "1.1",
      "date": "2026-02-18",
      "author": "unknown",
      "changes": "Expanded tips collection."
    },
    {
      "version": "1.0",
      "date": "unknown",
      "author": "initial",
      "changes": "Initial Go terminology tips."
    }
  ],
  "tips": [
    { "text": "Liberty (Dame): The breath of a stone. Without it, the stone perishes.", "category": "definition", "levels": ["novice", "beginner"] },
    { "text": "Atari: The final warning. One liberty remains before capture.", "category": "definition", "levels": ["novice", "beginner"] },
    { "text": "Ko: The rule of repetition. You must play elsewhere before recapturing.", "category": "definition", "levels": ["novice", "beginner", "elementary"] },
    { "text": "Eye (Me): A single safe point. Two eyes grant absolute life.", "category": "definition", "levels": ["novice", "beginner"] },
    { "text": "False Eye (Uso-me): A deceptive shape. It lacks the strength of a true eye.", "category": "definition", "levels": ["beginner", "elementary", "intermediate"] },
    { "text": "Life (Ikiru): Two eyes secure the group. It cannot be removed.", "category": "definition", "levels": ["novice", "beginner"] },
    { "text": "Death (Shisu): A group without eyes is lost. It returns to the bowl.", "category": "definition", "levels": ["beginner", "elementary"] },
    { "text": "Territory (Ji): Empty space surrounded by stones of a single color.", "category": "definition", "levels": ["novice", "beginner"] },
    { "text": "Influence (Atsumi): Power projected across the board from a strong position.", "category": "definition", "levels": ["elementary", "intermediate", "upper-intermediate"] },
    { "text": "Sente: The power of initiative. Force the opponent to respond to your lead.", "category": "definition", "levels": ["elementary", "intermediate"] },
    { "text": "Gote: The necessity of response. Maintain balance by following the lead.", "category": "definition", "levels": ["elementary", "intermediate"] },
    { "text": "Tenuki: The global vision. Play away from a local fight to gain greater value.", "category": "definition", "levels": ["elementary", "intermediate"] },
    { "text": "Tesuji: The sharpest tactic. Use technical brilliance to solve a local crisis.", "category": "definition", "levels": ["elementary", "intermediate"] },
    { "text": "Joseki: The balanced path. Established corner play where both sides prosper.", "category": "definition", "levels": ["elementary", "intermediate", "upper-intermediate"] },
    { "text": "Fuseki: The opening map. Stake your claim while the board is still vast.", "category": "definition", "levels": ["elementary", "intermediate"] },
    { "text": "Hoshi: The Star Point (4-4). The fourth line prioritizes influence and speed.", "category": "definition", "levels": ["beginner", "elementary"] },
    { "text": "Komoku: The 3-4 Point. A balanced start seeking roots and territory.", "category": "definition", "levels": ["beginner", "elementary"] },
    { "text": "Sansan: The 3-3 Point. A direct claim to the corner's deep territory.", "category": "definition", "levels": ["beginner", "elementary"] },
    { "text": "Keima: The Knight's Move. A swift, flexible leap for escape or pursuit.", "category": "definition", "levels": ["beginner", "elementary"] },
    { "text": "Kosumi: The Diagonal Move. A solid, unbreakable connection.", "category": "definition", "levels": ["beginner", "elementary"] },
    { "text": "Hane: The Bend. Strike around the edge of an opponent's stone.", "category": "definition", "levels": ["beginner", "elementary"] },
    { "text": "Nobi: The Stretch. Gain a liberty and strengthen your position.", "category": "definition", "levels": ["beginner", "elementary"] },
    { "text": "Takefu: The Bamboo Joint. An unbreakable connection across a one-point gap.", "category": "definition", "levels": ["beginner", "elementary"] },
    { "text": "Tsumego: The study of life and death. The foundation of reading power.", "category": "definition", "levels": ["novice", "beginner", "elementary"] },
    { "text": "Seki: Mutual life. A stalemate where neither side can strike safely.", "category": "definition", "levels": ["elementary", "intermediate"] },
    { "text": "Miai: Points of parity. If the opponent takes one, you take the other.", "category": "definition", "levels": ["elementary", "intermediate", "upper-intermediate"] },
    { "text": "Aji: Lingering potential. A hidden weakness waiting to be exploited.", "category": "definition", "levels": ["intermediate", "upper-intermediate"] },
    { "text": "Sabaki: The art of lightness. Settle a group within the opponent's sphere.", "category": "definition", "levels": ["upper-intermediate", "advanced", "low-dan"] },
    { "text": "Yose: The endgame phase. Finalize the borders with precision.", "category": "definition", "levels": ["intermediate", "upper-intermediate"] },
    { "text": "Dame: Neutral points. territory that belongs to neither side.", "category": "definition", "levels": ["novice", "beginner"] },
    { "text": "Snapback (Utogaeshi): A tactical sacrifice that captures right back.", "category": "definition", "levels": ["beginner", "elementary", "intermediate"] },
    { "text": "Net (Geta): Capture by surrounding without direct contact.", "category": "definition", "levels": ["beginner", "elementary"] },
    { "text": "Ladder (Shicho): A diagonal chase that ends at the board's edge.", "category": "definition", "levels": ["novice", "beginner", "elementary"] },
    { "text": "Semeai: A capturing race. A contest of breaths between two weak groups.", "category": "definition", "levels": ["elementary", "intermediate", "upper-intermediate"] },
    { "text": "Ikken-tobi: The one-point jump. The most balanced way to extend.", "category": "definition", "levels": ["beginner", "elementary"] },
    { "text": "Ponnuki: The flower shape. Four stones capturing one, radiating power.", "category": "definition", "levels": ["beginner", "elementary", "intermediate"] },
    { "text": "Tsuke: The attachment. A direct touch that creates strength and complexity.", "category": "definition", "levels": ["elementary", "intermediate"] },
    { "text": "Kiri: The cut. Severing the opponent's stones to create two weak groups.", "category": "definition", "levels": ["beginner", "elementary", "intermediate"] },
    { "text": "Komi: Compensation points given to White to balance the first-move advantage.", "category": "definition", "levels": ["novice", "beginner"] },
    { "text": "Moyo: A large, potential framework of territory.", "category": "definition", "levels": ["elementary", "intermediate", "upper-intermediate"] },
    { "text": "Nakade: The killing placement. A stone inside the eye space that prevents life.", "category": "definition", "levels": ["elementary", "intermediate", "upper-intermediate"] },
    { "text": "Damezumari: Liberty shortage. When your own stones run out of breath, tactics collapse.", "category": "definition", "levels": ["intermediate", "upper-intermediate", "advanced"] },
    { "text": "Horikomi: The throw-in. A sacrifice cast inside to destroy the opponent's eye shape.", "category": "definition", "levels": ["intermediate", "upper-intermediate", "advanced"] },
    { "text": "Oiotoshi: Connect-and-die. Stones in atari that remain lost even when they reach out.", "category": "definition", "levels": ["elementary", "intermediate", "upper-intermediate"] },
    { "text": "Ishi-no-shita: Under the stones. A tesuji played in the space vacated by captured stones.", "category": "definition", "levels": ["upper-intermediate", "advanced", "low-dan"] },
    { "text": "Watari: The underpass. Connecting two groups beneath the opponent's stones along the edge.", "category": "definition", "levels": ["elementary", "intermediate"] },
    { "text": "Nozoki: The peep. A move threatening to cut, usually demanding an immediate connection.", "category": "definition", "levels": ["elementary", "intermediate"] },
    { "text": "Kikashi: The forcing move. A play that compels a response, gaining advantage in passing.", "category": "definition", "levels": ["intermediate", "upper-intermediate", "advanced"] },
    { "text": "Shibori: The squeeze. Sacrificial stones that compress the opponent into a collapsed form.", "category": "definition", "levels": ["upper-intermediate", "advanced", "low-dan"] },
    { "text": "Degiri: Push and cut. A two-move sequence that wedges through, then severs the connection.", "category": "definition", "levels": ["elementary", "intermediate", "upper-intermediate"] },
    { "text": "Shicho-atari: The ladder breaker. A stone placed in the ladder's path that shatters the pursuit.", "category": "definition", "levels": ["elementary", "intermediate"] },
    { "text": "Osae: The block. A move that halts the opponent's advance along a line.", "category": "definition", "levels": ["beginner", "elementary"] },
    { "text": "Sagari: The descent. A move dropping straight toward the edge to secure a vital liberty.", "category": "definition", "levels": ["elementary", "intermediate"] },
    { "text": "Katachi: Shape. The form and efficiency of stones — good shape is the soul of strong play.", "category": "definition", "levels": ["elementary", "intermediate", "upper-intermediate"] },
    { "text": "Korigatachi: Over-concentrated shape. Stones clumped together, wasting their collective power.", "category": "definition", "levels": ["intermediate", "upper-intermediate"] },
    { "text": "Dango: A heavy, eyeless clump. The shape of wasted stones.", "category": "definition", "levels": ["beginner", "elementary", "intermediate"] },